Name,Price,Descriptions
Жакет со льном ELIS,"
                9 999 ₽            ","Однобортный жакет светло-голубого оттенка выполнен из фирменного смесового льна. Лёгкий материал не позволит коже перегреться в жару и не деформируется со временем. Модель прямого силуэта, со стояче-отложным воротником с лацканами, втачным рукавом 3/4, центральной застёжкой на три пуговицы и накладным карманом на груди. С брюками из той же коллекции составят однотонный тотал-лук в стиле смарт кэжуал."
Брюки прямые со льном ELIS,"
                6 999 ₽            ","Актуальные брюки светло цвета выполнены из фирменного смесового льна. Лёгкий материал не позволит коже перегреться в жару и не деформируется со временем. Модель прямого кроя, с притачным поясом со шлевками под ремень, французскими карманами и моделирующими вытачками сзади. С однобортным жакетом из того же материала составят однотонный тотал-лук в стиле смарт кэжуал."
Легкая ветровка ELIS,"
                7 999 ₽            ","Актуальная ветровка с воротником рубашечного типа деликатного пудрового оттенка выполнена из невесомого материала. Модифицированная вискоза мягкая, приятная к телу и обладает повышенной прочностью. Модель прямого силуэта, со спущенной линией плеча и проймой, длинным втачным рукавом с манжетом на резинке, центральной застёжкой на металлическую тесьму-молнию и накладными карманами на груди. Комфортная резинка по низу изделия обеспечивает удобную посадку по фигуре. Дополнит городской образ любой сложности."
Брюки из хлопка с тесьмой ELIS,"
                6 999 ₽            ","Лаконичные брюки пыльно-розового оттенка с декоративным поясом-тесьмой. Выполнены из плотного хлопкового полотна премиального качества, дышащий материал эластичный и приятный к коже. Модель прямого силуэта, слегка укороченная. Обтачной пояс со шлевками под ремень сзади присборен на резинку, что обеспечивает комфортную посадку. Образ можно дополнить базовой футболкой или легким топом."
Платье-миди из хлопка ELIS,"
                7 999 ₽            ","Элегантное платье-миди насыщенного синего цвета. Выполнено из невесомого дышащего полотна из хлопка премиального качества. Модель А-силуэта, с неглубоким V-образным вырезом и бретелями с легкими сборками, декорированными монилью. Широкий пояс-лента из основного материала подчеркивает талию и создает объёмные струящиеся драпировки. Образ можно дополнить открытыми босоножками, мюлями или классическими лодочками."
Рубашка льняная ELIS,"
                7 499 ₽            ","Рубашка свободного кроя с отложным воротником и длинными рукавами с манжетом. Модель изготовлена из мягкой 100% натуральной льняной ткани тонкого плетения. Застегивается планку с пуговицами, по бокам декоративные разрезы. Грудь украшает широкий накладной карман. На спинке кокетка с защипом для идеальной посадки в плечах. Модель сочетается с трикотажными облегающими топами, свободными брюками или джинсами."
Рубашка льняная ELIS,"
                7 499 ₽            ","Рубашка свободного кроя с отложным воротником и длинными рукавами с манжетом. Модель изготовлена из мягкой 100% натуральной льняной ткани тонкого плетения голубого цвета. Застегивается на планку с пуговицами, по бокам декоративные разрезы. Грудь украшает широкий накладной карман. На спинке кокетка с защипом для идеальной посадки в плечах. Модель сочетается с трикотажными облегающими топами, свободными брюками или джинсами."
Брюки из хлопка и льна ELIS,"
                5 999 ₽            ","Лаконичные брюки голубого цвета с легким авторским принтом ""клетка тартан"" в цвет изделию. Выполнены из мягкого материала на основе дышащего хлопка и натуральных льняных волокон, придающих ткани неповторимую текстуру. Модель прямого силуэта, с притачным поясом со шлевками под ремень и боковыми карманами с отрезным бочком, сзади по поясу резинка. Графичные стрелки выстраивают вертикаль визуально вытягивающую силуэт. Универсальные брюки отлично впишутся в повседневный гардероб."
Футболка с принтом из хлопка ELIS,"
                3 499 ₽            ","Базовая футболка универсального белого цвета с дизайнерским принтом на груди. Выполнена из фирменного хлопкового трикотажа премиального качества. Модель прямого силуэта, с коротким цельнокроеным рукавом с отворотом и круглой горловиной, обработанной бейкой. Лёгкая футболка удачно впишется в повседневный гардероб."
Юбка из хлопка и льна ELIS,"
                5 999 ₽            ","Юбка с имитацией запаха голубого цвета с легким авторским принтом ""клетка тартан"" в цвет изделию. Выполнена из легкого материала на основе дышащего хлопка и натуральных льняных волокон, придающих ткани неповторимую текстуру. Модель прямого силуэта, с обтачным поясом, рельефом и декоративными пуговицами спереди и моделирующими вытачками сзади. Универсальная юбка отлично впишется в повседневный гардероб."
Платье с флористическим принтом ELIS,"
                8 999 ₽            ","Элегантное платье-миди с дизайнерским принтом с флористическим паттерном. Выполнено из лёгкого вискозного полотна с добавлением нейлона, отвечающего за несковывающую движений посадку. Модель прямого силуэта, без рукавов, с круглой горловиной и разрезом по среднему шву сзади. Пояс-тесьма из основного материала подчеркивает талию и формирует утонченный силуэт. Образ можно дополнить открытыми босоножками или мюлями на каблуке."
Футболка с принтом из хлопка ELIS,"
                3 499 ₽            ","Комфортная футболка светло-желтого цвета с дизайнерским принтом на груди. Выполнена из фирменного хлопкового трикотажа премиального качества. Модель прямого силуэта, с коротким цельнокроеным рукавом с отворотом и круглой горловиной, обработанной бейкой. Лёгкая футболка удачно впишется в повседневный гардероб."
Блуза из вискозы ELIS,"
                4 499 ₽            ","Актуальная блуза цвета миндального масла выполнена из невесомого материала на основе вискозы. Натуральная ткань не препятствует циркуляции воздуха и не позволяет коже перегреваться в жаркую погоду. Модель прямого силуэта, увеличенного объёма, с неглубокой V-образной горловиной и короткими цельнокроеными рукавами с широкими манжетами, по бокам разрезы. Свободный крой обеспечивает удобную посадку на любой тип фигуры. С широкими брюками из той же коллекции составят однотонный тотал-лук для городских прогулок или отпуска."
Брюки прямые ELIS,"
                5 999 ₽            ","Трендовые широкие брюки цвета миндального масла. Выполнены из невесомого материала на основе вискозы, натуральная ткань не препятствует циркуляции воздуха и не позволяет коже перегреваться в жаркую погоду. Модель прямого силуэта, увеличенного объёма, с французскими карманами. Комфортный притачной пояс с резинкой и свободный крой обеспечивают удобную посадку на любой тип фигуры. С блузой из того же материала составят однотонный тотал-лук для городских прогулок или отпуска."
Жилет из вискозы на запах ELIS,"
                8 999 ₽            ","Актуальный жилет молочного оттенка выполнен из невесомого вискозного полотна премиального качества. Модель прямого силуэта, с воротником пиджачного типа с заострёнными лацканами, спущенной линией плеча, клапанами на груди и шлевками с декоративными концами. Пояс из основного материала удачно прочеркивает линию талии и обеспечивает комфортную посадку. Составит однотонной тотал-лук с брюками из того же материала."
Брюки прямые из вискозы ELIS,"
                6 999 ₽            ","Брюи деликатного молочного оттенка выполнены из невесомого вискозного полотна премиального качества. Модель прямого кроя, с притачным поясом со шлёвками под ремень, косыми карманами и лёгкими защипами спереди. Составят однотонной тотал-лук с жилетом из того же материала."
Вязаная блуза с V-вырезом ELIS,"
                4 999 ₽            ","Стильная вязаная блуза из объемной пряжи на основе хлопка персикового цвета. Модель полуприлегающего силуэта, с V-образной горловиной, цельновязаным рукавом и комфортным поясом по низу изделия. По горловине и центру изделия располагается фактурная отделка с особым переплетением нитей. Блуза универсально сочетается с просторной одеждой в светлых тонах: юбками-макси и миди, широкими длинными брюками и обувью на плоской подошве."
Вязаная блуза с V-вырезом ELIS,"
                4 999 ₽            ","Вязаная блуза оттенка экрю выполнена из фирменной пряжи на основе длинноволокнистого хлопка. Модель полуприлегающего силуэта, с V-образной горловиной, цельновязаным рукавом и комфортным поясом по низу изделия. По горловине и центру изделия располагается фактурная отделка с особым переплетением нитей. Легкая блуза дополнит как лук в стиле кэжуал, так и нестрогий деловой лук."
Укороченная рубашка из вискозы ELIS,"
                4 999 ₽            ","Укороченная рубашка нежного лавандового оттенка. Выполнена из гладкого вискозного полотна, лёгкий материал приятен к коже и не препятствует циркуляции воздуха. Модель прямого силуэта, с отложным воротником, спущенной линией плеча и проймой, свободным втачным рукавом и центральной застёжкой на планку с пуговицами. По низу изделия по бокам резинка. Составит однотонный тотал-лук с юбкой на запах из той же ткани."
Топ трикотажный ELIS,"
                2 499 ₽            ","Минималистичный топ прямого облегающего силуэта с фигурным широким вырезом в пастельно-лавандовом оттенке. Топ из вискозного трикотажа, на широких цельнокроеных бретелях, без застежки. Базовая вещь гардероба. Универсально эффектно подходит под пиджаки, жакеты и брючные костюмы, а также сочетается со свободными рубашками и джинсами."
Брюки с накладными карманами ELIS,"
                5 999 ₽            ","Стильные укороченные брюки свободного кроя, стилизованные под силуэт “карго”, с двумя накладными карманами спереди и одним сзади. Модель из 100% плотного хлопка светло-бежевого оттенка. Сзади на талии для идеальной посадки выполнены вытачки. Силуэт позволяет сочетать брюки с кроссовками и обувью на каблуке, а также пиджаками оверсайз."
Топ трикотажный ELIS,"
                2 499 ₽            ","Минималистичный топ прямого облегающего силуэта с фигурным широким вырезом в белом цвете. Топ из вискозного трикотажа, на широких цельнокроеных бретелях, без застежки. Базовая вещь гардероба. Универсально эффектно подходит под пиджаки, жакеты и брючные костюмы, а также сочетается со свободными рубашками и джинсами."
Платье-комбинация из вискозы ELIS,"
                6 999 ₽            ","Эффектное платье-комбинация нежного лилового оттенка. Выполнено из гладкого полотна на основе вискозы премиального качества, невесомый материал почти не ощущается на коже. Модель прямого силуэта, длины миди, с квадратным вырезом горловины, тонкими бретелями с бельевыми фиксаторами сзади и горизонтальной декоративной лямкой на спинке. Утончённое платье можно дополнить актуальными босоножками или классическими лодочками."
Блузка с капюшоном ELIS,"
                4 999 ₽            ","Комфортная блуза оттенка горький шоколад выполнена из лёгкого вискозного полотна. Дышащий материал приятен к коже и почти не мнётся. Модель прямого силуэта, с коротким цельнокроеным рукавом и металлической тесьмой-молнией до линии груди. Завершает дизайн удобный капюшон, функциональная деталь защитит от солнца или ветра. С шортами-бермудами из того же материала составит однотонный тотал-лук для прогулок на природе или отпуска."
Шорты-бермуды на резинке ELIS,"
                4 999 ₽            ","Повседневные шорты-бермуды оттенка горький шоколад выполнены из лёгкого вискозного полотна. Дышащий материал приятен к коже и почти не мнется. Модель прямого силуэта, с притачным поясом с эластичной резинкой и декоративными шнурками. Свободный крой обеспечивает комфортную посадку на любой тип фигуры. С блузой из того же материала составят однотонный тотал-лук для прогулок на природе или отпуска."
Футболка с V-вырезом ELIS,"
                3 499 ₽            ","Свободная футболка прямого силуэта из мягкого хлопка плотного гладкого плетения. Модель в пастельно-розовом оттенке с просторным цельнокроенным коротким рукавом. В сочетании с V-образным вырезом создается плавный силуэт, который будет выгодно подчеркиваться жакетом. Спереди вырез декорирован монилью. Модель сочетается со свободными брюками и шортами."
Платье-рубашка из вискозы ELIS,"
                6 999 ₽            ","Лаконичное платье-рубашка оттенка горький шоколад выполнено из лёгкого вискозного полотна. Модель прямого силуэта, с воротником рубашечного типа, со спущенной линией плеча, свободным втачным коротким рукавом и центральной застёжкой на планку с пуговицами. По шву притачивания кокетки спереди легкая драпировка. Линию талии можно подчеркнуть поясом-лентой из основного материала с декоративным украшением. Образ можно дополнить как обувью на каблуке, так и кедами."
Джинсовая куртка ELIS,"
                8 999 ₽            ","Актуальная куртка базового белого цвета с крупными металлическими пуговицами. Выполнена из плотного хлопкового денима, особое переплетение нитей обеспечивает ткани прочность и износостойкость. Модель прямого силуэта, увеличенного объёма и слегка укороченной длины со стояче-отложным воротником, втачным рукавом со сборкой по линии плеча и манжетом с пуговицами. Рельефы спереди и по спинке формируют удачную посадку, завершают дизайн накладные карманы с клапанами. С юбкой-миди из того же материала составят однотонный тотал-лук в стиле кэжуал."
Топ на тонких бретелях ELIS,"
                3 999 ₽            ","Топ из эффектной атласной ткани универсального чёрного цвета. Модель минималистичного кроя, полуприлегающего силуэта, с прямым вырезом переда и спинки. Такой силуэт в сочетании с цветом выгодно подчеркивает линию плеч. Стильная базовая вещь, которая сочетается как с деловым так и неформальным гардеробом. Идеальна в комплекте с широкими черными брюками из той же капсулы."
Джинсовая юбка на пуговицах ELIS,"
                6 999 ₽            ","Лаконичная юбка базового белого цвета с застёжкой на крупные металлические пуговицы. Выполнена из плотного хлопкового денима, особое переплетение нитей обеспечивает ткани прочность и износостойкость. Модель прямого силуэта, с притачным поясом со шлёвками под ремень и французскими карманами. Моделирующие талиевые вытачки формируют комфортную посадку по фигуре. С легкой курткой из того же материала составят однотонный тотал-лук в стиле кэжуал."
Топ на бретелях ELIS,"
                3 999 ₽            ",Топ полуприлегающего силуэта на бретелях. Спереди фигурный треугольный вырез и диагональные подрезы.
