Name,Price,Descriptions
Джинсовая куртка ELIS,"
                11 999 ₽            ","Стильная джинсовая куртка из мягкого хлопкового денима изысканного брусничного оттенка. Короткая модель прямого свободного кроя, с длинными рукавами с манжетами на крупной кнопке, отложным воротником, двумя нагрудными накладными карманами с застегивающимися клапанами и удобной застёжкой на крупные кнопки в тон. Благодаря однотонному оттенку изделия его легко сочетать с цветными вещами с рисунком. Куртка будет элегантно смотреться в комплекте с джинсами из той же капсулы."
Джинсы из эластичного денима ELIS,"
                5 999 ₽            ","Джинсы прямые насыщенного розового оттенка. Выполнены из хлопкового денима премиального качества, плотный легкий материал отлично тянется, обеспечивая комфортную посадку по фигуре. Модель прямого кроя, с притачным поясом со шлевками под ремень, боковыми карманами и часовым карманом спереди, и накладными американскими сзади. Джинсы дополнят образ в стиле кэжуал, легко сочетать с базовыми футболками или легкими топами."
Вязаный топ ELIS,"
                3 999 ₽            ","Вязаная блуза базового белого цвета с вывязанным рисунком на груди. Выполнена из мягкой фирменной пряжи на основе хлопка. Модель прямого силуэта, среднего объёма, без рукавов, с комфортной резинкой в рубчик по низу изделия и элегантной горловиной лодочкой. Универсальная модель дополнит лук в стиле кэжуал или нестрогий деловой образ."
Вязаная блуза с пайетками ELIS,"
                5 999 ₽            ","Фактурная вязаная блуза базового белого цвета с пайетками. Выполнена из мягкой хлопковой пряжи премиального качества. Модель полуприлегающего силуэта, среднего объёма, со спущенной линией плеча и подвязом в рубчик по круглой горловине, низу изделия и манжетам. Универсальная блуза отлично впишется в повседневный гардероб."
Футболка в полоску ELIS,"
                3 999 ₽            ","Актуальная футболка в полоску с авторским набивным принтом на груди. Выполнена из мягкого материала на основе дышащей вискозы и эластичных волокон, отвечающих за несковывающую движений посадку. Модель прямого силуэта, со спущенной линией плеча, втачным рукавом и круглой горловиной, обработанной бейкой. Базовую футболку легко сочетать с джинсами, брюками или юбками."
Платье-миди без рукавов ELIS,"
                7 999 ₽            ","Изящное платье-миди серого цвета с контрастным чёрным принтом с флористическим паттерном, выполнено из лёгкого струящегося полотна. Модель А-силуэта, без рукавов, с круглой горловиной и широким ремнём-акцентом на талии обтянутым основным материалом. Комфортный крой и вытачки по спинке формируют удачную посадку. Платье дополненное трендовыми мюлями составят актуальный повседневный лук, с классическими лодочками - образ для выхода в свет."
Вязаный топ ELIS,"
                3 999 ₽            ","Вязаная блуза насыщенного бирюзового оттенка с вывязанным рисунком на груди. Выполнена из мягкой фирменной пряжи на основе хлопка. Модель прямого силуэта, среднего объёма, без рукавов, с комфортной резинкой в рубчик по низу изделия и элегантной горловиной лодочкой. Универсальная модель дополнит лук в стиле кэжуал или нестрогий деловой образ."
Джинсы прямые серые ELIS,"
                5 999 ₽            ","Трендовые джинсы ""5 карманов"" с необработанным краем и разрезами по низу. Выполнены из светло-серого фирменного денима на основе хлопка с добавлением эластана, обеспечиващего не сковывающую движений посадку. Модель прямого силуэта, с притачным поясом со шлевками под ремень, боковыми карманами и часовым карманом спереди, и накладными американскими сзади. Джинсы в стиле кэжуал легко дополнить принтованными футболками или легкими топами."
Комбинезон фуксия ELIS,"
                8 999 ₽            ","Эффектный комбинезон насыщенного оттенка фуксия. Выполнен из дышащего материала премиального качества на основе хлопка. Модель прямого силуэта, на широких бретелях, с квадратным вырезом горловины, вырезом по спинке и широкими брюками-кюлотами. Комфортная резинка подчёркивает талию и создаёт утонченный силуэт - песочные часы. Образ можно дополнить актуальными молями на каблуке или открытыми босоножками."
Комбинезон черный ELIS,"
                8 999 ₽            ","Элегантный комбинезон базового чёрного цвета. Выполнен из дышащего материала премиального качества на основе хлопка. Модель прямого силуэта, на широких бретелях, с квадратным вырезом горловины, вырезом по спинке и широкими брюками-кюлотами. Комфортная резинка подчёркивает талию и создаёт утонченный силуэт - песочные часы. Образ можно дополнить актуальными молями на каблуке или открытыми босоножками."
Легкий блейзер с поясом ELIS,"
                8 999 ₽            ","Однобортный жакет графитового оттенка с фирменным принтом ""polka-dot"". Выполнен из миксовой костюмной ткани на основе мягкого хлопка, прочных поливолокон и дышащей вискозы. Модель прямого кроя, с коротким втачным рукавом, стояче-отложным воротником с заострёнными лацканами и накладными карманами с фигурными клапанами. Идущий в комплекте пояс-лента из того же материала подчёркивает талию и формирует утонченный силуэт. Составят однотонный тотал-лук в стиле смарт кэжуал с брюками со стрелками или юбкой из того же материала."
Юбка А-силуэта ELIS,"
                5 999 ₽            ","Элегантная юбка графитового оттенка с фирменным принтом ""polka-dot"". Выполнена из миксовой костюмной ткани на основе мягкого хлопка, прочных поливолокон и дышащей вискозы. Модель А-силуэта с притачным поясом со шлевками под ремень, карманами спереди и застёжкой на потайную молнию. Лёгкие драпировки по подолу формируют утонченный женственный силуэт. Составит однотонный тотал-лук в стиле смарт кэжуал с жакетом из того же материала."
Футболка с принтом ELIS,"
                2 999 ₽            ","Белоснежная футболка с дизайнерским принтом, декорированным паетками. Выполнена из легкого миксового трикотажа на основе дышащей вискозы, с добавлением прочных поливолокон и эластана. Модель прямого силуэта, с коротким цельнокроеным рукавом и круглой горловиной, обработанной бейкой. Универсальная футболка с оригинальным декором дополнит повседневный образ любой сложности."
Брюки прямые костюмные ELIS,"
                6 499 ₽            ","Лаконичные брюки графитового оттенка с фирменным принтом ""polka-dot"". Выполнены из миксовой костюмной ткани на основе мягкого хлопка, прочных поливолокон и дышащей вискозы. Модель прямого силуэта, с притачным поясом со шлевками под ремень, карманами с отрезным бочком и моделирующими вытачками сзади. Графичные заутюженные стрелки выстраивают вертикаль визуально вытягивающую силуэт. Составят однотонный тотал-лук в стиле смарт кэжуал с жакетом из того же материала."
Футболка с капюшоном ELIS,"
                4 999 ₽            ","Актуальная белоснежная футболка с капюшоном. На груди авторская вышивка. Выполнена из мягкого хлопкового трикотажа, дыщаший материал приятен к коже и комфортно тянется. Модель прямого силуэта, умеренного объема, с цельнокроеным рукавом и удобным регулируемым капюшоном со шнурком. Составит актуальный тотал-лук с шортами из того же материала."
Шорты спортивные ELIS,"
                4 999 ₽            ","Трендовые спортивные шорты базового белого цвета. Выполнены из легкого дышащего трикотажа на основе хлопка, с добавлением прочных поливолокон. Модель прямого кроя, увеличенного объёма, с эластичным поясом на резинке и боковыми карманами с отрезным бочком. Составят актуальный тотал-лук с футболкой с капюшоном из того же материала."
Легкий бомбер из трикотажа ELIS,"
                6 999 ₽            ","Бомбер на молнии белого цвета декорирован монилью. Выполнен из легкого дышащего трикотажа на основе хлопка с добавлением прочных поливолокон. Модель прямого кроя, с центральной застёжкой на тесьму-молнию, коротким рукавом и боковыми карманами. С брюками с отворотами из того же материала составят однотонный тотал-лук для путешествий или прогулок на свежем воздухе."
Брюки спортивные с отворотами ELIS,"
                6 999 ₽            ","Лаконичные брюки с отворотами универсального белого цвета. Выполнены из легкого дышащего трикотажа на основе хлопка, с добавлением прочных поливолокон. Модель прямого кроя, с эластичным поясом на резинке с регулируемой кулиской и боковыми карманами с отрезным бочком. С бомбером из того же материала составят однотонный тотал-лук для путешествий или прогулок  на свежем воздухе."
Платье прямое с V-вырезом на спине ELIS,"
                6 999 ₽            ","Платье универсального чёрного цвета с контрастным дизайнерским принтом с флористическим мотивом на груди. Выполнено из лёгкого трикотажа на основе дышащей вискозы и прочных нейлоновых волокон. Модель прямого кроя с коротким цельнокроеным рукавом, эффектным V-образным вырезом сзади и неглубоким разрезом на подоле. Платье в стиле кэжуал легко дополнить мюлями, босоножками или кроссовками."
Платье-миди из вискозы ELIS,"
                5 999 ₽            ","Платье-миди базового черного цвета выполнено из лёгкого миксового материала на основе дышащий вискозы и эластичного нейлона. Модель прямого силуэта, с круглым вырезом горловины, эффектным разрезом и V-образным вырезом сзади. Свободный крой обеспечивает комфортную посадку на любой тип фигуры. Образ можно дополнить открытыми босоножками или классическими лодочками."
Платье-миди из вискозы ELIS,"
                5 999 ₽            ","Платье средней длины зеленого оттенка. Без рукавов, с круглым вырезом и неглубоким разрезом. Платье прямого кроя. Отличный выбор для создания повседневного летнего образа."
Юбка-карандаш прямая ELIS,"
                4 999 ₽            ",Прямая юбка-карандаш. Карманы с клапанами. Застежка на гульфик. Спереди шлица.
Платье-комбинация из вискозы ELIS,"
                6 999 ₽            ","Струящееся белоснежное платье-комбинация с контрастным принтом. Выполнено из гладкой дышащей вискозы, лёгкий материал приятен к коже и почти не ощущается. Модель прямого силуэта, на тонких бретелях, с V-образным вырезом горловины и нагрудными вытачками, обеспечивающими удачную посадку. Образ можно дополнить открытыми босоножками или мюлями на каблуке."
Платье-миди розовое из вискозы LALIS,"
                7 999 ₽            ","Лаконичное платье-миди насыщенного розового оттенка выполнено из гладкого вискозного полотна. Модель А-силуэта, с цельнокроёным рукавом с защипом и манжетом, отложным воротником, неглубоким V-образным вырезом и центральной застёжкой на планку с пуговицами. Образ можно дополнить поясом-лентой из основного материала, сделав акцент на линии талии. Платье легко сочетать с босоножками или кедами."
Блуза с поясом LALIS,"
                5 999 ₽            ","Свободная блуза с коротким цельнокроенным рукавом с подворотом из мягкой экологичной вискозы гладкого плетения. Силуэт формируется при помощи тонкого пояса из основной ткани изделия. Блузу можно запахнуть или надеть вместе с облегающим топом. Женственности добавляет фантазийный растительный узор в сиренево-фиолетовых тонах. Застегивается на планку с пуговицами, по бокам разрезы. Блуза сочетается со свободной юбкой-миди из той же капсулы, а также подходит под неформальные брюки и обувь на каблуке."
Жакет малиновый со льном LALIS,"
                11 999 ₽            ","Однобортной жакет насыщенного малинового оттенка выполнен из смесового льна премиального качества. Модель прямого кроя, со стояче-отложным воротником с лацканами, втачным рукавом с манжетом и центральной застёжкой на пуговицы. Пояс-лента из основного материала подчёркивает линию талии и формирует изящный силуэт. С брюками или юбкой из той же коллекции составят однотонный тотал-лук в стиле смарт кэжуал."
Топ базовый из трикотажа LALIS,"
                2 999 ₽            ","Минималистичный топ прямого облегающего силуэта с фигурным круглым вырезом в белом цвете. Модель из эластичного материала на основе хлопка и модала, на широких цельнокроеных бретелях, без застежки. Базовая вещь гардероба. Универсально подходит под пиджаки, жакеты и брючные костюмы, а также сочетается со свободными рубашками и джинсами."
Юбка на запах со льном LALIS,"
                5 999 ₽            ","Легкая юбка насыщенного малинового оттенка выполнены из смесового льна премиального качества. Модель А-силуэта, на запах с двумя пуговицами спереди, длиной чуть ниже колена. Комфортная посадка делает юбку удачным выбором для любого типа фигуры. Составит однотонный тотал-лук в стиле смарт кэжуал с жакетом из той же коллекции."
Брюки прямые со льном LALIS,"
                7 999 ₽            ","Комфортные брюки насыщенного малинового оттенка выполнены из смесового льна премиального качества. Модель прямого кроя, с притачным поясом со шлевками под ремень и резинкой по спинке, по бокам косые карманы. С однобортным жакетом из этой же коллекции составят однотонный тотал-лук в стиле смарт кэжуал."
Блуза из вискозы LALIS,"
                5 999 ₽            ","Лаконичная блуза оттенка оптический белый выполнена из тончайшего полотна на основе модифицированной вискозы. Невесомый материал чуть просвечивает, блузу удобно сочетать с базовым топом. Модель прямого силуэта, с небольшим воротником стойкой, длинным цельнокроеным рукавом с манжетом и центральной застёжкой на пуговицы. Лёгкая блуза дополнит городской образ любой сложности."
Топ базовый из трикотажа LALIS,"
                2 999 ₽            ","Минималистичный топ прямого облегающего силуэта с фигурным круглым вырезом в нежно-голубом цвете. Модель из эластичного материала на основе хлопка и модала, на широких цельнокроеных бретелях, без застежки. Базовая вещь гардероба. Универсально подходит под пиджаки, жакеты и брючные костюмы, а также сочетается со свободными рубашками и джинсами."
Брюки прямые из хлопка LALIS,"
                6 999 ₽            ","Комфортные прямые брюки желтого цвета выполнены из эластичного хлопкового полотна. Лёгкий дышащий материал с добавлением эластана обеспечивает не сковывающую движений посадку. Модель прямого силуэта, с косыми карманами, притачным поясом со шлевками под ремень и резинкой по спинке, с моделирующмими вытачками и имитацией кармана с листочкой сзади. Повседневные брюки удачно впишутся в базовый гардероб."
Футболка трикотажная в полоску LALIS,"
                3 499 ₽            ","Фтболка в морском стиле в бело-жёлтой гамме с фирменной вышивкой на груди. Выполнена из эластичного трикотажа на основе вискозы. Модель прямого силуэта, с втачным рукавом и круглой горловиной, обработанной бейкой. Повседневная футболка дополнит как городской образ, так и расслабленный отпускной лук."
