Name,Price,Descriptions
Брюки изо льна ELIS,"
                6 999 ₽            ","Лаконичные брюки универсального черного цвета выполнены из фирменного льняного полотна. Дышащий материал не препятствует циркуляции воздуха и не позволит коже перегреться. Модель прямого кроя, с застежкой на пуговицу и молнию, и карманами в боковых швах. Притачной пояс с комфортной резинкой сзади и легкими защипами спереди обеспечивают удобную посадку по фигуре. Графичные стрелки выстраивают вертикаль, визуально вытягивающую силуэт. Брюки в стиле смарт кэжуал можно дополнить контрастным топом или классической блузой."
Топ на тонких бретелях ELIS,"
                3 999 ₽            ","Топ из эффектной атласной ткани нежно-розового цвета. Модель минималистичного кроя, полуприлегающего силуэта, с прямым вырезом переда и спинки. Силуэт выгодно подчеркивает линию плеч. Стильная базовая вещь, которая сочетается как с деловым так и неформальным гардеробом. Идеальна в комплекте с широкими черными брюками из той же капсулы."
Свободные брюки из вискозы ELIS,"
                6 999 ₽            ","Стильные брюки из мягкой экологичной вискозы практичного черного цвета. Свободная модель, расклешенная от бедра, с удобным поясом на резинке, люверсами и декоративным шнурком, украшенным металлическими наконечниками. По бокам вместительные карманы, спереди простроченные стрелки. Брюки легко сочетать как с футболками, так и с белыми рубашками и трикотажем."
Рубашка со льном ELIS,"
                6 999 ₽            ","Удлиненная рубашка насыщенного салатового оттенка выполнена из легко материала премиального качества. Дышащая вискоза приятна к коже, натуральные льняные волокна поддерживают оптимальную температуру и придают ткани неповторимую текстуру. Модель прямого силуэта, с отложным воротником с заострёнными лацканами, спущенной линией плеча и втачным рукавом с имитацией манжета. Дополнена декоративными клапанам на груди, навесной верхней петлей из основного материала и разрезами в боковых швах. Образ можно завершить комфортными брюками, джинсами или юбкой."
Джинсы прямые ELIS,"
                5 999 ₽            ","Лаконичные джинсы ""5 карманов"" оттенка оптический белый выполнены из лёгкого денима премиального качества. Дышащий хлопковый материал тянется, обеспечивая комфортную посадку по фигуре. Модель прилегающего силуэта, с притачным поясом со шлевками под ремень, боковыми карманами с фигурным входом, декоративным часовым карманом и накладными американскими сзади. Базовую модель можно дополнить легкой блузой или актуальным топом."
Вязаный топ из вискозы ELIS,"
                3 999 ₽            ","Вязаный топ эффектного прилегающего силуэта из фактурного тонкого вязаного полотна на основе экологичной вискозы светлого-лилового оттенка. Лаконичная модель с горловиной ""американка"". Топ входит в базовый повседневный гардероб и может стать универсальной основой костюмов для офиса и путешествий в сочетании с юбками, брюками и жакетами."
Юбка джинсовая ELIS,"
                5 999 ₽            ","Лаконичная прямая юбка из плотного хлопкового денима оттенка свежего лайма. Прочный лёгкий материал отлично тянется, обеспечивая не сковывающую движений посадку. Модель прямого силуэта, с притачным поясом со шлёвками под ремень, застёжкой на тесьму-молнию сзади и прямоугольными карманами. Юбку в стиле кэжуал можно дополнить актуальными блузами или легкими топами."
Вязаный топ из вискозы ELIS,"
                3 999 ₽            ","Вязаный топ эффектного прилегающего силуэта из фактурного тонкого полотна на основе экологичной вискозы в оттенке лайм. Лаконичная модель с горловиной ""американка"". Топ входит в базовый повседневный гардероб и может стать универсальной основой костюмов для офиса и путешествий в сочетании с юбками, брюками и жакетами."
Рубашка с объемными рукавами ELIS,"
                5 999 ₽            ","Белоснежная блуза выполнена из легкого хлопкового полотна. Дышащий материал приятен к коже и прост в уходе. Модель прямого силуэта, со стояче-отложным воротником, спущенной линией плеча и центральной застёжкой на планку с пуговицами. Объёмные рукава со сборками по окату присобраны у манжета, линия втачивания рукава декорирована  ажурным просвечивающим кружевом. Блуза в стиле смарт кэжуал дополнит повседневный образ любой сложности."
Брюки из хлопка укороченные ELIS,"
                6 499 ₽            ","Укороченные брюки розового цвета. Выполнены из лёгкого миксового полотна, хлопок приятен к телу, поливолокна отвечают за прочность, эластичный спандекс за удобную посадку по фигуре. Модель прямого силуэта, средней посадки, с притачным поясом со шлёвками под ремень, талиевыми вытачками и французскими карманами. Универсальные брюки дополнят лук в стиле кэжуал или станут альтернативой классическим брюкам для нестрогого офисного образа."
Платье-миди со льном ELIS,"
                7 999 ₽            ","Оригинальное платье-миди насыщенного салатового оттенка с полуоткрытой спиной. Выполнено из невесомого материала на основе натуральных льняных волокон и дышащей вискозы, придающих неповторимую текстуру полотну. Модель А-силуэта, с эластичным поясом-акцентом на талии, круглой горловиной и подолом с лёгкими драпировками. Верхняя часть платья присборена спереди на талии на резинку, задняя часть платья - отлетная. Образ можно дополнить открытыми босоножками или мюлями."
Рубашка изо льна и хлопка ELIS,"
                5 999 ₽            ","Яркая рубашка с завязками насыщенного желтого цвета окрашенная в технике тай-дай. Выполнена из лёгкого материала на основе дышащего хлопка и натуральных льняных волокон. Модель прямого силуэта, со стояче-отложным воротником, длинным рукавом с манжетом, центральной застёжкой на пуговицы и накладным карманом на груди. Удлиненные полы завязаны в комфортный узел на талии. Образ можно дополнить юбкой, шортами или джинсами."
Джинсовая юбка-карандаш ELIS,"
                5 999 ₽            ","Лаконичная юбка из плотного хлопкового денима деликатного светло-голубого оттенка. Прочный лёгкий материал отлично тянется, обеспечивая не сковывающую движений посадку. Модель прямого силуэта, с притачным поясом со шлёвками под ремень и французскими карманами. Длина изделия чуть выше колена. Юбку в стиле кэжуал можно дополнить актуальными блузами или легкими топами."
Блуза из модала ELIS,"
                4 999 ₽            ","Необычная блуза с завязками насыщенного розового оттенка выполнена из лёгкого мягкого полотна на основе модала - инновационного вискозного материала из буковой или эвкалиптовой древесины. Модель прямого силуэта, со стояче-отложным воротником, свободным коротким рукавом, центральной застёжкой на пуговицы и сборками по линии плеча. Удлиненные полы спереди завязаны в комфортный узел. Образ можно дополнить юбкой, шортами или джинсами."
Свободная рубашка изо льна ELIS,"
                6 999 ₽            ","Рубашка свободного кроя ментолового оттенка выполнена из натурального льняного полотна. Органический материал с неповторимой текстурой защищает от жары, не позволяя коже перегреваться. Модель прямого силуэта, среднего объёма, со стояче-отложным воротником, спущенной линией плеча, свободным втачным рукавом с манжетом на пуговице, центральной застёжкой на пуговицы и накладным карманом на груди. Составит однотонный тотал-лук с брюками-кюлотами из того же материала."
Брюки изо льна с кулиской ELIS,"
                6 999 ₽            ","Трендовые прямые брюки насыщенного зелёного цвета выполнены из натурального льняного полотна. Органический материал с неповторимой текстурой защищает от жары, не позволяя коже перегреваться. Модель прямого силуэта, укороченные, с боковыми карманами. Эластичный пояс-резинка с регулируемой кулиской обеспечивает не сковывающую движений посадку. Составит однотонный тотал-лук с оверсайз рубашкой из той же ткани."
Платье-миди из вискозы ELIS,"
                7 999 ₽            ","Изящное платье-миди в бело-голубой гамме с авторским цветочным принтом и удлиненным сзади подолом. Выполнено из летящего вискозного полотна, натуральный дышащий материал приятен к коже и лёгок в уходе. Модель А-силуэта с неглубоким V-образным вырезом горловины и свободными рукавами-крылышками. Под грудью тесьма из основного материала, создающая нежный женственный силуэт. Элегантный образ можно завершить открытыми босоножками или мюлями на каблуке."
Платье-туника из хлопка ELIS,"
                7 999 ₽            ","Легкое платье-туника белого цвета. Выполнено из невесомого 100% хлопка с вышивкой. Модель А-силута, со свободными рукавами, присобранными у манжета, притачным нижним ярусом с легкими драпировками, круглой горловиной с разрезом и кулиской с кисточками. В комплекте идёт нижнее платье на бретелях. С открытыми босоножками составят актуальный городской лук, с пляжной обувью образ для отпуска."
Платье изо льна без рукавов ELIS,"
                7 999 ₽            ","Лаконичное платье-миди из натурального льна насыщенного розового цвета. Эффектная минималистичная модель с оригинальным вырезом в верхней части спины и разрезами по бокам, за счет которых силуэт выглядит летящим. Застегивается на потайную молнию сбоку. Средняя длина выгодно подчеркивает ноги, платье выглядит максимально эффектно в сочетании с обувью на шпильке и легким светлым пиджаком."
Платье изо льна без рукавов ELIS,"
                7 999 ₽            ","Лаконичное платье-миди из натурального льна нежно-зелёного оттенка. Эффектная минималистичная модель с оригинальным вырезом в верхней части спины и разрезами по бокам, за счет которых силуэт выглядит летящим. Застегивается на потайную молнию сбоку. Средняя длина выгодно подчеркивает ноги, платье выглядит максимально эффектно в сочетании с обувью на шпильке и легким светлым пиджаком."
Платье-миди без рукавов ELIS,"
                6 999 ₽            ","Изящное платье без рукавов василькового оттенка выполнено из невесомого летящего материала. Мягкая дышащая вискоза приятна к телу, а прочные нейлоновые волокна не позволят ткани деформироваться со временем. Модель А-силуэта, с V-образным вырезом горловины, небольшими сборками на плечах и подолом с притачным ярусом с лёгкими воланами. Аккуратный ремень выгодно подчёркивает талию и формирует нежные драпировки. Образ можно дополнить актуальными открытыми босоножками или классическими лодочками."
Топ с ярким принтом ELIS,"
                3 999 ₽            ","Лёгкий топ с дизайнерским геометрическим принтом в бруснично-красной гамме. Выполнен из невесомого материала на основе вискозы и купры — искусственной ткани, похожей на шёлк, из натурального сырья — древесины и хлопка. Модель прямого силуэта, с эффектными разрезами по бокам, вытачками, круглой окантованной горловиной и проймами, и застёжкой на пуговицу сзади. С брюками-палаццо из того же материала составит однотонный тотал-лук для городских прогулок или выхода в свет."
Свободные брюки с ярким принтом ELIS,"
                7 499 ₽            ","Широкие брюки с дизайнерским геометрическим принтом в бруснично-красной гамме. Выполнены из невесомого материала на основе вискозы и купры — искусственной ткани, похожей на шёлк, из натурального сырья — древесины и хлопка. Модель прямого силуэта, с французскими карманами и комфортным притачным поясом с резинкой, обеспечивающим удобную посадку. С топом из той же ткани составят однотонный тотал-лук для городских прогулок или выхода в свет."
Легкая куртка изо льна ELIS,"
                9 999 ₽            ","Комфортная куртка фирменного оттенка оптический белый выполнена из натурального льна премиального качества. Лёгкий материал с неповторимой текстурой приятен к коже и не препятствует циркуляции воздуха. Модель прямого силуэта, увеличенного объёма, с рукавом-реглан, центральной застёжкой на тесьму-молнию и крупными накладными карманами. Без подкладки. Завершает дизайн удобный капюшон с кулиской. Лёгкая куртка станет базой повседневного гардероба."
Футболка вязаная с V-вырезом ELIS,"
                3 999 ₽            ","Футболка прямого свободного кроя из вязаного трикотажа на основе экологичной вискозы и льна в лаконичном пастельно-голубом оттенке. Модель в V-образной горловиной, втачными короткими рукавами, свободно облегающими руку. Рукава и горловина отделаны манжетами. Крой позволяет носить футболку заправленной и навыпуск. Модель сочетается с шортами, брюками и обувью в спортивном стиле. Must have для путешествий и отпуска."
Шорты льняные ELIS,"
                5 999 ₽            ","Стильные шорты из натурального мягкого льна универсального белого цвета. Модель комфортного среднего облегания, прямого кроя, с поясом на резинке с кулиской для регулирования объема талии. По бокам функциональные прорезные карманы. Модель сочетать с футболками, легкими жакетами светлых оттенков и обувью в спортивном стиле. Must have для гардероба в отпуск."
Платье-комбинация ELIS,"
                6 999 ₽            ","Изящное струящееся платье-комбинация сдержанного коричневого цвета выполнено из лёгкого гладкого материала. Модель прямого силуэта, на тонких бретелях, с V-вырезом и нагрудными вытачками, обеспечивающими комфортную посадку. Образ можно дополнить открытыми босоножками или мюлями на каблуке."
Платье-комбинация ELIS,"
                6 999 ₽            ","Cтруящееся платье актуального горчичного оттенка выполнено из лёгкого гладкого материала на основе вискозы. Модель прямого силуэта, на тонких изящных бретелях, с глубоким округлым вырезом и нагрудными вытачками, обеспечивающими комфортную посадку. Женственный образ можно дополнить открытыми босоножками или мюлями на каблуке."
Футболка из вискозы ELIS,"
                2 999 ₽            ","Повседневная футболка оттенка экрю с авторским принтом на груди. Выполнена из мягкой дышащей вискозы премиального качества, волокна эластана в составе отвечает за комфортную посадку по фигуре. Модель прямого силуэта, с цельнокроеным коротким рукавом и круглым вырезом горловины. Универсальная футболка в стиле кэжуал дополнит городской образ любой сложности. Легко сочетать с брюками, джинсами или юбками."
Платье с цветочным принтом ELIS,"
                8 999 ₽            ","Длинное платье из лёгкой экологичной вискозы с мелким цветочным принтом. Модель имеет прямой крой с расклешенным низом, V-образную горловину, присборенный у плеча лиф и изящные рукава-фонарики."
Платье с цветочным принтом ELIS,"
                8 999 ₽            ","Длинное платье из лёгкой экологичной вискозы EcoVero с мелким цветочным принтом. Модель имеет приталенный за счёт резинок силуэт с расклешенным низом, V-образную горловину, застёжку спереди на пуговицы, обтянутые тканью, присборенный у плеча лиф, изящные рукава-фонарики и эффектный разрез спереди."
